Source,SourceLong,Target,Dramatist,Play_Title,Play_Title_Short,Act,Scene,Line_Number,Speaker,Location,Line,Physical_Location,Location_Score,In_London_Or_London,Mentioned_as_Location,Purpose,Location1,Location_General,Location_Specific,Details
Ben Jonson.Bartholomew Fair,Ben Jonson.Bartholomew Fair.4.6.36,4020,Ben Jonson,Bartholomew Fair,Bartholomew Fair,4,6,36,Wasp,Wales,"Sir, you are a Welsh cuckold, and a prating runt, and no constable.",TRUE,(4) Europe,FALSE,FALSE,Nationality,Wales,,,
Ben Jonson.Bartholomew Fair,Ben Jonson.Bartholomew Fair.4.6.54,1204,Ben Jonson,Bartholomew Fair,Bartholomew Fair,4,6,54,Haggis,Bartholomew Fair,"Why, he says just nothing. What should he say? Or where should he",TRUE,(1) Specific London Location,TRUE,TRUE,Other,England,London,Bartholomew Fair,
Ben Jonson.Bartholomew Fair,Ben Jonson.Bartholomew Fair.4.6.84,4117,Ben Jonson,Bartholomew Fair,Bartholomew Fair,4,6,84,Busy,Rome,"of these superstitious relics, those lists of Latin, the very rags of Rome and",TRUE,(4) Europe,FALSE,FALSE,Descriptor,Italy,Rome,,
Ben Jonson.Bartholomew Fair,Ben Jonson.Bartholomew Fair.4.6.102,1204,Ben Jonson,Bartholomew Fair,Bartholomew Fair,4,6,102,Purecraft,Bartholomew Fair,"Oh, good sir, they have set the faithful here to be wondered at, and",TRUE,(1) Specific London Location,TRUE,TRUE,Location,England,London,Bartholomew Fair,Purecraft here speaks of the stocks provided 'here' at the location the Fair.
Ben Jonson.Bartholomew Fair,Ben Jonson.Bartholomew Fair.4.6.103,4004,Ben Jonson,Bartholomew Fair,Bartholomew Fair,4,6,103,Purecraft,England,provided holes for the holy of the land.,TRUE,(4) Europe,FALSE,FALSE,Descriptor,England,,,A reference to England?
Ben Jonson.Bartholomew Fair,Ben Jonson.Bartholomew Fair.5.1.2,1204,Ben Jonson,Bartholomew Fair,Bartholomew Fair,5,1,2,Lantern,Bartholomew Fair,"in the name of wit, and do  you beat the drum the while! All the foul i'the Fair",TRUE,(1) Specific London Location,TRUE,TRUE,Other,England,London,Bartholomew Fair,
Ben Jonson.Bartholomew Fair,Ben Jonson.Bartholomew Fair.5.1.3,2118,Ben Jonson,Bartholomew Fair,Bartholomew Fair,5,1,3,Lantern,Smithfield,I mean all the dirt in Smithfield - that's one of Master Littlewit's carwitchets,TRUE,(2) General London Location,TRUE,TRUE,Location,England,London,Smithfield,
Ben Jonson.Bartholomew Fair,Ben Jonson.Bartholomew Fair.5.1.6,5109,Ben Jonson,Bartholomew Fair,Bartholomew Fair,5,1,6,Lantern,Jerusalem,"time, since my master Pod died! Jersusalem Pod was a master of motions",TRUE,"(5) World, outside Europe",FALSE,FALSE,Other,Israel,Jerusalem,,
Ben Jonson.Bartholomew Fair,Ben Jonson.Bartholomew Fair.5.1.8,3126,Ben Jonson,Bartholomew Fair,Bartholomew Fair,5,1,8,Lantern,Norwich,"The City of Norwich, and Sodom and Gomorrah, with the rising o'the prentices",TRUE,"(3) England, outside London",FALSE,FALSE,Other,England,Norfolk,Norwich,
Ben Jonson.Bartholomew Fair,Ben Jonson.Bartholomew Fair.5.1.8,6104,Ben Jonson,Bartholomew Fair,Bartholomew Fair,5,1,8,Lantern,Sodom,"The City of Norwich, and Sodom and Gomorrah, with the rising o'the prentices",FALSE,(6) Not on Earth,FALSE,FALSE,Other,Jordon River valley,Sodom,,"Accoding to the Bible, these locations were destroyed by God. It is suggested they have historical basis, but that the actual locations may have been renamed in the bible or based upon real cities, such as Tall el-Hammam. As such, they are assigned 6, not on earth."
Ben Jonson.Bartholomew Fair,Ben Jonson.Bartholomew Fair.5.1.8,6102,Ben Jonson,Bartholomew Fair,Bartholomew Fair,5,1,8,Lantern,Gomorrah,"The City of Norwich, and Sodom and Gomorrah, with the rising o'the prentices",FALSE,(6) Not on Earth,FALSE,FALSE,Other,Jordon River valley,Gomorrah,,
Ben Jonson.Bartholomew Fair,Ben Jonson.Bartholomew Fair.5.1.11,2115,Ben Jonson,Bartholomew Fair,Bartholomew Fair,5,1,11,Lantern,London,twenty-pence audience nine times in an afternoon. Your home-born projects,TRUE,(2) General London Location,TRUE,FALSE,Descriptor,England,London,,"The 'home-born projects' line may be a wry allusion to Jonson's own plays, of which the ones based in London (home) were more successful."
Ben Jonson.Bartholomew Fair,Ben Jonson.Bartholomew Fair.5.2.54,4004,Ben Jonson,Bartholomew Fair,Bartholomew Fair,5,2,54,Purecraft,England,"would have had me, but I know him to be the capital knave of the land",TRUE,(4) Europe,TRUE,TRUE,Location,England,,,
Ben Jonson.Bartholomew Fair,Ben Jonson.Bartholomew Fair.5.3.11,1279,Ben Jonson,Bartholomew Fair,Bartholomew Fair,5,3,11,Filcher,Puppet show booth,"Yes, sir. Please come you near; we'll take your money within.",FALSE,(1) Specific London Location,TRUE,TRUE,Location,England,Bartholomew Fair,Puppet show booth,
Ben Jonson.Bartholomew Fair,Ben Jonson.Bartholomew Fair.5.3.24,1204,Ben Jonson,Bartholomew Fair,Bartholomew Fair,5,3,24,Cokes,Bartholomew Fair,"lost all i'the Fair, and all my acquaintance too. Did'st thou meet anybody that",TRUE,(1) Specific London Location,TRUE,TRUE,Other,England,London,Bartholomew Fair,
Ben Jonson.Bartholomew Fair,Ben Jonson.Bartholomew Fair.5.3.27,1279,Ben Jonson,Bartholomew Fair,Bartholomew Fair,5,3,27,Cokes,Puppet show booth,"here. I'll pay thee again, as I am a gentleman. If thou'lt but carry me home, I",FALSE,(1) Specific London Location,TRUE,TRUE,Location,England,Bartholomew Fair,Puppet show booth,
Ben Jonson.Bartholomew Fair,Ben Jonson.Bartholomew Fair.5.3.27,3202,Ben Jonson,Bartholomew Fair,Bartholomew Fair,5,3,27,Cokes,Cokes's house,"here. I'll pay thee again, as I am a gentleman. If thou'lt but carry me home, I",FALSE,"(3) England, outside London",FALSE,TRUE,Location,England,Harrow on the Hill,Cokes's house,
Ben Jonson.Bartholomew Fair,Ben Jonson.Bartholomew Fair.5.3.46,1279,Ben Jonson,Bartholomew Fair,Bartholomew Fair,5,3,46,Lantern,Puppet show booth,"Troth, siir, our tiring housee is somewhat little: we are but beginners",FALSE,(1) Specific London Location,TRUE,TRUE,Location,England,Bartholomew Fair,Puppet show booth,
Ben Jonson.Bartholomew Fair,Ben Jonson.Bartholomew Fair.5.3.51,2007,Ben Jonson,Bartholomew Fair,Bartholomew Fair,5,3,51,Cokes,London theatres,as they have at other houses? Let me see some o'your actors.,TRUE,(2) General London Location,TRUE,TRUE,Location,England,London,London theatres,
Ben Jonson.Bartholomew Fair,Ben Jonson.Bartholomew Fair.5.3.85,5203,Ben Jonson,Bartholomew Fair,Bartholomew Fair,5,3,85,Lantern,The Hellespont/the Dardanelles strait,"what do they know what Hellespont is, 'guilty of true love's blood'? Or what",TRUE,"(5) World, outside Europe",FALSE,TRUE,Location,Turkey,,The Hellespont/the Dardanelles strait,"Now called the Dardanelles strait, was called Hellespont in Marlowe's Hero and Leander, which is the subject of conversation at this point in the play."
Ben Jonson.Bartholomew Fair,Ben Jonson.Bartholomew Fair.5.3.86,5101,Ben Jonson,Bartholomew Fair,Bartholomew Fair,5,3,86,Lantern,Abydos,"Abydos is, or 'the other, Sestos hight'?",TRUE,"(5) World, outside Europe",FALSE,TRUE,Location,Turkey,,Abydos,
Ben Jonson.Bartholomew Fair,Ben Jonson.Bartholomew Fair.5.3.86,5114,Ben Jonson,Bartholomew Fair,Bartholomew Fair,5,3,86,Lantern,Sestos,"Abydos is, or 'the other, Sestos hight'?",TRUE,"(5) World, outside Europe",FALSE,TRUE,Location,Turkey,,Sestos,
Ben Jonson.Bartholomew Fair,Ben Jonson.Bartholomew Fair.5.3.93,5203,Ben Jonson,Bartholomew Fair,Bartholomew Fair,5,3,93,Littlewit,The Hellespont/the Dardanelles strait,"as, for the Hellespont I imagine our Thames here; and then Leander, I make a",TRUE,"(5) World, outside Europe",FALSE,TRUE,Location,Turkey,,The Hellespont/the Dardanelles strait,
Ben Jonson.Bartholomew Fair,Ben Jonson.Bartholomew Fair.5.3.93,1295,Ben Jonson,Bartholomew Fair,Bartholomew Fair,5,3,93,Littlewit,Thames River,"as, for the Hellespont I imagine our Thames here; and then Leander, I make a",TRUE,(1) Specific London Location,TRUE,TRUE,Location,England,London,Thames River,
Ben Jonson.Bartholomew Fair,Ben Jonson.Bartholomew Fair.5.3.94,1278,Ben Jonson,Bartholomew Fair,Bartholomew Fair,5,3,94,Littlewit,Puddle Wharf,"dyer's son about Puddle Wharf and Heero a wench o'the Bankside, who, going",TRUE,(1) Specific London Location,TRUE,TRUE,Location,England,London,Puddle Wharf,
Ben Jonson.Bartholomew Fair,Ben Jonson.Bartholomew Fair.5.3.94,2119,Ben Jonson,Bartholomew Fair,Bartholomew Fair,5,3,94,Littlewit,South bank of the Thames,"dyer's son about Puddle Wharf and Heero a wench o'the Bankside, who, going",TRUE,(2) General London Location,TRUE,TRUE,Location,England,London,South bank of the Thames,
Ben Jonson.Bartholomew Fair,Ben Jonson.Bartholomew Fair.5.3.95,1269,Ben Jonson,Bartholomew Fair,Bartholomew Fair,5,3,95,Littlewit,Old Fish Street,"over one morning to Old Fish Street, Leander spies her land at Trig Stairs",TRUE,(1) Specific London Location,TRUE,TRUE,Location,England,London,Old Fish Street,Not to be confused with New Fish Street.
Ben Jonson.Bartholomew Fair,Ben Jonson.Bartholomew Fair.5.3.95,1308,Ben Jonson,Bartholomew Fair,Bartholomew Fair,5,3,95,Littlewit,Trig Stairs,"over one morning to Old Fish Street, Leander spies her land at Trig Stairs",TRUE,(1) Specific London Location,TRUE,TRUE,Location,England,London,Trig Stairs,"Access to the north bank of the river by Trig Lane, a little downstream of Puddle Wharf - John Creaser."
Ben Jonson.Bartholomew Fair,Ben Jonson.Bartholomew Fair.5.4.28,1279,Ben Jonson,Bartholomew Fair,Bartholomew Fair,5,4,28,Edgworth,Puppet show booth,"Madam, you are very welcome hither.",FALSE,(1) Specific London Location,TRUE,TRUE,Location,England,Bartholomew Fair,Puppet show booth,
Ben Jonson.Bartholomew Fair,Ben Jonson.Bartholomew Fair.5.4.32,1279,Ben Jonson,Bartholomew Fair,Bartholomew Fair,5,4,32,Edgworth,Puppet show booth,"This is a very private house, madam.",FALSE,(1) Specific London Location,TRUE,TRUE,Location,England,Bartholomew Fair,Puppet show booth,
Ben Jonson.Bartholomew Fair,Ben Jonson.Bartholomew Fair.5.4.60,1204,Ben Jonson,Bartholomew Fair,Bartholomew Fair,5,4,60,Filcher,Bartholomew Fair,"Twopence apiece, sir: the  best motion in the Fair.",TRUE,(1) Specific London Location,TRUE,TRUE,Other,England,London,Bartholomew Fair,
Ben Jonson.Bartholomew Fair,Ben Jonson.Bartholomew Fair.5.4.63,1279,Ben Jonson,Bartholomew Fair,Bartholomew Fair,5,4,63,Wasp,Puppet show booth,Did you see a master of mine come in here: a tall young squire of Harrow,FALSE,(1) Specific London Location,TRUE,TRUE,Location,England,Bartholomew Fair,Puppet show booth,
Ben Jonson.Bartholomew Fair,Ben Jonson.Bartholomew Fair.5.4.63-64,3117,Ben Jonson,Bartholomew Fair,Bartholomew Fair,5,4,63-64,Wasp,Harrow on the Hill,"Did you see a master of mine come in here: a tall young squire of Harrow | o'the Hill, Master Barthol'mew Cokes?",TRUE,"(3) England, outside London",FALSE,TRUE,Location,England,Middlesex,Harrow on the HIll,
Ben Jonson.Bartholomew Fair,Ben Jonson.Bartholomew Fair.5.4.65,1279,Ben Jonson,Bartholomew Fair,Bartholomew Fair,5,4,65,Filcher,Puppet show booth,I think there may be such a one within.,FALSE,(1) Specific London Location,TRUE,TRUE,Location,England,Bartholomew Fair,Puppet show booth,
Ben Jonson.Bartholomew Fair,Ben Jonson.Bartholomew Fair.5.4.68,3224,Ben Jonson,Bartholomew Fair,Bartholomew Fair,5,4,68,Wasp,Uxbridge Fair,the five legs and two pizzles - he was a calf at Uxbridge Fair two years agone,TRUE,"(3) England, outside London",FALSE,FALSE,Other,England,Middlesex,Uxbridge Fair,"Similarly to Bartholomew Fair, where the name could refer to both the location and the event, this is given the Purpose 'Other'."
Ben Jonson.Bartholomew Fair,Ben Jonson.Bartholomew Fair.5.4.97,1278,Ben Jonson,Bartholomew Fair,Bartholomew Fair,5,4,97,Lantern,Puddle Wharf,"For he yet serves his father, a dyer at Puddle Wharf,",TRUE,(1) Specific London Location,TRUE,TRUE,Location,England,London,Puddle Wharf,
Ben Jonson.Bartholomew Fair,Ben Jonson.Bartholomew Fair.5.4.98,5101,Ben Jonson,Bartholomew Fair,Bartholomew Fair,5,4,98,Lantern,Abydos,"Which place we'll make bold with to call it our Abydos,",TRUE,"(5) World, outside Europe",FALSE,TRUE,Location,Turkey,,Abydos,
Ben Jonson.Bartholomew Fair,Ben Jonson.Bartholomew Fair.5.4.99,2119,Ben Jonson,Bartholomew Fair,Bartholomew Fair,5,4,99,Lantern,South bank of the Thames,"As the Bankside is our Sestos, and let it not be denied us.",TRUE,(2) General London Location,TRUE,TRUE,Location,England,London,South bank of the Thames,
Ben Jonson.Bartholomew Fair,Ben Jonson.Bartholomew Fair.5.4.99,5114,Ben Jonson,Bartholomew Fair,Bartholomew Fair,5,4,99,Lantern,Sestos,"As the Bankside is our Sestos, and let it not be denied us.",TRUE,"(5) World, outside Europe",FALSE,TRUE,Location,Turkey,,Sestos,
Ben Jonson.Bartholomew Fair,Ben Jonson.Bartholomew Fair.5.4.116,1308,Ben Jonson,Bartholomew Fair,Bartholomew Fair,5,4,116,Puppet Leander,Trig Stairs,Was that fare that thou landest but now at Trig Stairs?,TRUE,(1) Specific London Location,TRUE,TRUE,Location,England,London,Trig Stairs,
Ben Jonson.Bartholomew Fair,Ben Jonson.Bartholomew Fair.5.4.119,1308,Ben Jonson,Bartholomew Fair,Bartholomew Fair,5,4,119,Lantern,Trig Stairs,Was the fare that he landed but now at Trig Stairs?,TRUE,(1) Specific London Location,TRUE,TRUE,Location,England,London,Trig Stairs,
Ben Jonson.Bartholomew Fair,Ben Jonson.Bartholomew Fair.5.4.124,2119,Ben Jonson,Bartholomew Fair,Bartholomew Fair,5,4,124,Lantern,South bank of the Thames,"Of the Bankside, he saith - to tell you truth without erring -",TRUE,(2) General London Location,TRUE,TRUE,Location,England,London,South bank of the Thames,
Ben Jonson.Bartholomew Fair,Ben Jonson.Bartholomew Fair.5.4.125,1269,Ben Jonson,Bartholomew Fair,Bartholomew Fair,5,4,125,Lantern,Old Fish Street,Is come over into Fish Street to eat some fresh herring.,TRUE,(1) Specific London Location,TRUE,TRUE,Location,England,London,Old Fish Street,"Assumed to be Old Fish Street, considering this one was mentioned previously."
Ben Jonson.Bartholomew Fair,Ben Jonson.Bartholomew Fair.5.4.127,1293,Ben Jonson,Bartholomew Fair,Bartholomew Fair,5,4,127,Lantern,Swan Inn,"Gets on all his best clothes, and will after to the Swan.",TRUE,(1) Specific London Location,TRUE,TRUE,Location,England,London,Swan Inn,"Probably the Swan near the Hoop, near Bread Street. - John Creaser."
Ben Jonson.Bartholomew Fair,Ben Jonson.Bartholomew Fair.5.4.138,2003,Ben Jonson,Bartholomew Fair,Bartholomew Fair,5,4,138,Puppet Cole,London brothels,"Yes, Goodman Hogrubber o' Pict-hatch.",TRUE,(2) General London Location,TRUE,FALSE,Descriptor,England,London,London brothels,"Pict-/Picked-hatch' began to refer to brothels, especially in Rotten Row, Goswell Road, a little north of Smithfield. - John Creaser."
Ben Jonson.Bartholomew Fair,Ben Jonson.Bartholomew Fair.5.4.139,2003,Ben Jonson,Bartholomew Fair,Bartholomew Fair,5,4,139,Lantern,London brothels,"How, Hogrubber o' Pict-hatch?",TRUE,(2) General London Location,TRUE,FALSE,Descriptor,England,London,London brothels,
Ben Jonson.Bartholomew Fair,Ben Jonson.Bartholomew Fair.5.4.140,2003,Ben Jonson,Bartholomew Fair,Bartholomew Fair,5,4,140,Puppet Cole,London brothels,"Ay, Hogrubber o' Pict-hatch.",TRUE,(2) General London Location,TRUE,FALSE,Descriptor,England,London,London brothels,
Ben Jonson.Bartholomew Fair,Ben Jonson.Bartholomew Fair.5.4.183,1293,Ben Jonson,Bartholomew Fair,Bartholomew Fair,5,4,183,Lantern,Swan Inn,And lodged in that alehouse in which fair Hero does do.,TRUE,(1) Specific London Location,TRUE,TRUE,Location,England,London,Swan Inn,
Ben Jonson.Bartholomew Fair,Ben Jonson.Bartholomew Fair.5.4.185,1269,Ben Jonson,Bartholomew Fair,Bartholomew Fair,5,4,185,Lantern,Old Fish Street,Is come fair Hero in Fish Street this morning to seek:,TRUE,(1) Specific London Location,TRUE,TRUE,Location,England,London,Old Fish Street,
Ben Jonson.Bartholomew Fair,Ben Jonson.Bartholomew Fair.5.4.243,1295,Ben Jonson,Bartholomew Fair,Bartholomew Fair,5,4,243,Puppet Leander,Thames River,"I'll swim o'er the Thames, my goose thee to tread.",TRUE,(1) Specific London Location,TRUE,TRUE,Location,England,London,Thames River,
Ben Jonson.Bartholomew Fair,Ben Jonson.Bartholomew Fair.5.4.244,1295,Ben Jonson,Bartholomew Fair,Bartholomew Fair,5,4,244,Cokes,Thames River,"Brave! He will swim o'er the Thames and tread his goose tonight, he says.",TRUE,(1) Specific London Location,TRUE,TRUE,Location,England,London,Thames River,
Ben Jonson.Bartholomew Fair,Ben Jonson.Bartholomew Fair.5.4.247,1295,Ben Jonson,Bartholomew Fair,Bartholomew Fair,5,4,247,Puppet Leander,Thames River,"But lest the Thames should be dark, my goose, my dear friend,",TRUE,(1) Specific London Location,TRUE,TRUE,Location,England,London,Thames River,
Ben Jonson.Bartholomew Fair,Ben Jonson.Bartholomew Fair.5.4.258,3124,Ben Jonson,Bartholomew Fair,Bartholomew Fair,5,4,258,Lantern,Little Dunmow,"After sack and fresh herring, with your Dunmow bacon.",TRUE,"(3) England, outside London",FALSE,FALSE,Descriptor,England,Essex,Little Dunmow,
Ben Jonson.Bartholomew Fair,Ben Jonson.Bartholomew Fair.5.4.259,4121,Ben Jonson,Bartholomew Fair,Bartholomew Fair,5,4,259,Puppet Pythias,Westphalia,"You lie, it's Westfabian.",TRUE,(4) Europe,FALSE,FALSE,Descriptor,Germany,,Wesphalia,
Ben Jonson.Bartholomew Fair,Ben Jonson.Bartholomew Fair.5.4.269,4121,Ben Jonson,Bartholomew Fair,Bartholomew Fair,5,4,269,Lantern,Westphalia,"Westphalian', you should say.",TRUE,(4) Europe,FALSE,FALSE,Descriptor,Germany,,Westphalia,
Ben Jonson.Bartholomew Fair,Ben Jonson.Bartholomew Fair.5.5.19,3101,Ben Jonson,Bartholomew Fair,Bartholomew Fair,5,5,19,Knockem,Banbury,Good Banbury-vapours.,TRUE,"(3) England, outside London",FALSE,FALSE,Descriptor,England,Oxfordshire,Banbury,
Ben Jonson.Bartholomew Fair,Ben Jonson.Bartholomew Fair.5.5.68,2104,Ben Jonson,Bartholomew Fair,Bartholomew Fair,5,5,68,Puppet Dionysius,Blackfriars,"or feather-makers i'the Friars, that are o'your faction of faith?",TRUE,(2) General London Location,TRUE,TRUE,Location,England,London,Blackfriars,
Ben Jonson.Bartholomew Fair,Ben Jonson.Bartholomew Fair.5.5.72,4005,Ben Jonson,Bartholomew Fair,Bartholomew Fair,5,5,72,Puppet Dionysius,France,"calling? Or the confect-makers, such you have there? Or your French fashioner? You'd",TRUE,(4) Europe,FALSE,FALSE,Nationality,France,,,
Ben Jonson.Bartholomew Fair,Ben Jonson.Bartholomew Fair.5.6.27,2115,Ben Jonson,Bartholomew Fair,Bartholomew Fair,5,6,27,Justice Overdo,London,"upon me, O London! and see me, O Smithfield: the Example of Justice and",TRUE,(2) General London Location,TRUE,TRUE,Location,England,London,,
Ben Jonson.Bartholomew Fair,Ben Jonson.Bartholomew Fair.5.6.27,2118,Ben Jonson,Bartholomew Fair,Bartholomew Fair,5,6,27,Justice Overdo,Smithfield,"upon me, O London! and see me, O Smithfield: the Example of Justice and",TRUE,(2) General London Location,TRUE,TRUE,Location,England,London,Smithfield,
Ben Jonson.Bartholomew Fair,Ben Jonson.Bartholomew Fair.5.6.78,3115,Ben Jonson,Bartholomew Fair,Bartholomew Fair,5,6,78,Quarlous,Finsbury,"Nay, sir, stand not you fixed here like a stake in Finsbury to be shot at, or the",TRUE,"(3) England, outside London",FALSE,TRUE,Location,England,Middlesex,Finsbury,
Ben Jonson.Bartholomew Fair,Ben Jonson.Bartholomew Fair.5.6.79,1204,Ben Jonson,Bartholomew Fair,Bartholomew Fair,5,6,79,Quarlous,Bartholomew Fair,"whipping-post i'the Fair, but get your wife o'the air - it will make her",TRUE,(1) Specific London Location,TRUE,TRUE,Other,England,London,Bartholomew Fair,
Ben Jonson.Bartholomew Fair,Ben Jonson.Bartholomew Fair.5.6.92,1250,Ben Jonson,Bartholomew Fair,Bartholomew Fair,5,6,92,Justice Overdo,Justice Overdo's house,I invite you home with me to my house for supper. I will have,FALSE,(1) Specific London Location,TRUE,TRUE,Location,England,London,Justice Overdo's house,
Ben Jonson.Bartholomew Fair,Ben Jonson.Bartholomew Fair.5.6.95,1250,Ben Jonson,Bartholomew Fair,Bartholomew Fair,5,6,95,Cokes,Justice Overdo's house,"Yes, and bring the actors along: we'll ha' the rest of the play at home!",FALSE,(1) Specific London Location,TRUE,TRUE,Location,England,London,Justice Overdo's house,
Ben Jonson.Devil,Ben Jonson.Devil.1.1.0,6006,Ben Jonson,The Devil is an Ass,Devil,1,1,0,Stage Direction,Hell,Enter Satan and Pug in hell.,FALSE,(6) Not on Earth,FALSE,TRUE,Location,Hell,,Hell,
Ben Jonson.Devil,Ben Jonson.Devil.1.1.6,6201,Ben Jonson,The Devil is an Ass,Devil,1,1,6,Pug,Court of Hell,"Within that term, the Court of Hell will hear",FALSE,(6) Not on Earth,FALSE,TRUE,Location,Hell,Court of Hell,Court of Hell,
Ben Jonson.Devil,Ben Jonson.Devil.1.1.11,1208,Ben Jonson,The Devil is an Ass,Devil,1,1,11,Satan,Blackfriars Theatre,Twixt this and Tottenham? These were wont to be,TRUE,(1) Specific London Location,TRUE,TRUE,Location,England,London,Blackfriars Theatre,"In the context in which Satan is speaking, 'this' means both the setting (Hell) AND Blackfriars Theatre, as it shares with the Prologue a strong sense of the stage location."
Ben Jonson.Devil,Ben Jonson.Devil.1.1.11,6006,Ben Jonson,The Devil is an Ass,Devil,1,1,11,Satan,Hell,Twixt this and Tottenham? These were wont to be,FALSE,(6) Not on Earth,FALSE,TRUE,Location,Hell,,Hell,"In the context in which Satan is speaking, 'this' means both the setting (Hell) AND Blackfriars Theatre, as it shares with the Prologue a strong sense of the stage location."
Ben Jonson.Devil,Ben Jonson.Devil.1.1.11,3132,Ben Jonson,The Devil is an Ass,Devil,1,1,11,Satan,Tottenham,Twixt this and Tottenham? These were wont to be,TRUE,"(3) England, outside London",FALSE,TRUE,Location,England,Tottenham,Tottenham,Village near London
Ben Jonson.Devil,Ben Jonson.Devil.1.1.16,3122,Ben Jonson,The Devil is an Ass,Devil,1,1,16,Satan,Kentish Town,Or some good ribble about Kentish Town?,TRUE,"(3) England, outside London",FALSE,TRUE,Location,England,Kentish Town,Kentish Town,"At this time, outside London."
Ben Jonson.Devil,Ben Jonson.Devil.1.1.17,3120,Ben Jonson,The Devil is an Ass,Devil,1,1,17,Satan,Hoxton,"Or Hoxton, you would hang now for a witch",TRUE,"(3) England, outside London",FALSE,TRUE,Location,England,Hoxton,Hoxton,"At this time, outside London."
Ben Jonson.Devil,Ben Jonson.Devil.1.1.21,3010,Ben Jonson,The Devil is an Ass,Devil,1,1,21,Satan,Middlesex,"By a Middlesex jury, to the satisfaction",TRUE,"(3) England, outside London",FALSE,TRUE,Location,England,Middlesex,Middlesex,
Ben Jonson.Devil,Ben Jonson.Devil.1.1.22,2115,Ben Jonson,The Devil is an Ass,Devil,1,1,22,Satan,London,"Of their offended friends, the Londoners' wives",TRUE,(2) General London Location,TRUE,FALSE,Nationality,England,London,London,
Ben Jonson.Devil,Ben Jonson.Devil.1.1.31,2115,Ben Jonson,The Devil is an Ass,Devil,1,1,31,Satan,London,"Here about London. You would make, I think",TRUE,(2) General London Location,TRUE,TRUE,Location,England,London,London,
Ben Jonson.Devil,Ben Jonson.Devil.1.1.32,3008,Ben Jonson,The Devil is an Ass,Devil,1,1,32,Satan,Lancashire,An agent to be sent for Lancashire,TRUE,"(3) England, outside London",FALSE,TRUE,Location,England,Lancashire,Lancashire,
Ben Jonson.Devil,Ben Jonson.Devil.1.1.33,3013,Ben Jonson,The Devil is an Ass,Devil,1,1,33,Satan,Northumberland,Proper enough; or some parts of Northumberland,TRUE,"(3) England, outside London",FALSE,TRUE,Location,England,Northumberland,Northumberland,
Ben Jonson.Devil,Ben Jonson.Devil.1.1.56,2106,Ben Jonson,The Devil is an Ass,Devil,1,1,56,Iniquity,Cheapside,From the top of Paul's steeple to the Standard in Cheap,TRUE,(2) General London Location,TRUE,TRUE,Location,England,London,Cheapside,
Ben Jonson.Devil,Ben Jonson.Devil.1.1.56,1270,Ben Jonson,The Devil is an Ass,Devil,1,1,56,Iniquity,Old St Paul's Cathedral,From the top of Paul's steeple to the Standard in Cheap,TRUE,(1) Specific London Location,TRUE,TRUE,Location,England,London,Old St Paul's Cathedral,
Ben Jonson.Devil,Ben Jonson.Devil.1.1.58,4017,Ben Jonson,The Devil is an Ass,Devil,1,1,58,Iniquity,Spain,"Like a needle of Spain, with a thread at my tail",TRUE,(4) Europe,FALSE,TRUE,Location,Spain,,Spain,
Ben Jonson.Devil,Ben Jonson.Devil.1.1.59,2124,Ben Jonson,The Devil is an Ass,Devil,1,1,59,Iniquity,Suburbs outside the city walls,"We will survey the suburbs, and make foorth our sallies",TRUE,(2) General London Location,TRUE,TRUE,Location,England,London,Suburbs outside the city walls,
Ben Jonson.Devil,Ben Jonson.Devil.1.1.60,1274,Ben Jonson,The Devil is an Ass,Devil,1,1,60,Iniquity,Petticoat Lane,"Down Petticoat Lane, and up the Smock Alleys",TRUE,(1) Specific London Location,TRUE,TRUE,Location,England,London,Petticoat Lane,
Ben Jonson.Devil,Ben Jonson.Devil.1.1.60,1286,Ben Jonson,The Devil is an Ass,Devil,1,1,60,Iniquity,Smock Alleys,"Down Petticoat Lane, and up the Smock Alleys",TRUE,(1) Specific London Location,TRUE,TRUE,Location,England,London,Smock Alleys,
Ben Jonson.Devil,Ben Jonson.Devil.1.1.61,2117,Ben Jonson,The Devil is an Ass,Devil,1,1,61,Iniquity,Shoreditch,"To Shoreditch, Whitechapel, and so to St Kather'ne's",TRUE,(2) General London Location,TRUE,TRUE,Location,England,London,Shoreditch,
Ben Jonson.Devil,Ben Jonson.Devil.1.1.61,2121,Ben Jonson,The Devil is an Ass,Devil,1,1,61,Iniquity,St Katherine's district,"To Shoreditch, Whitechapel, and so to St Kather'ne's",TRUE,(2) General London Location,TRUE,TRUE,Location,England,London,St Katherine's district,
Ben Jonson.Devil,Ben Jonson.Devil.1.1.61,2131,Ben Jonson,The Devil is an Ass,Devil,1,1,61,Iniquity,Whitechapel,"To Shoreditch, Whitechapel, and so to St Kather'ne's",TRUE,(2) General London Location,TRUE,TRUE,Location,England,London,Whitechapel,
Ben Jonson.Devil,Ben Jonson.Devil.1.1.62,4013,Ben Jonson,The Devil is an Ass,Devil,1,1,62,Iniquity,Netherlands,"To drink with the Dutch there, and take forth their patterns.",TRUE,(4) Europe,FALSE,FALSE,Nationality,Netherlands,,Netherlands,
